{
  "catalog_id": "public-artifact-catalog-v0",
  "date": "2026-04-19",
  "title": "Public Artifact Catalog v0",
  "clinical_use_boundary": "research-use-only",
  "generated_from": "*.metadata.json files tracked in the public repo",
  "review": {
    "created": "2026-04-14",
    "last_reviewed": "2026-04-19",
    "review_status": "expert-review-needed",
    "review_notes": [
      "Generated from public artifact metadata for navigation.",
      "Structural catalog only; inclusion does not mean expert review, clinical readiness, or publication approval.",
      "Public boundary excludes private lab material, patient-identifying data, credentials, restricted datasets, and unreviewed exports."
    ]
  },
  "entries": [
    {
      "artifact_id": "bcma-antigen-escape-claim-set-v0",
      "title": "BCMA Antigen Escape Claim Set v0",
      "artifact_class": "dataset",
      "claim_level": "derived",
      "blood_cancer_scope": [
        "multiple myeloma",
        "BCMA-directed therapy",
        "post-BCMA relapse",
        "post-CAR T relapse"
      ],
      "path": "disease-programs/multiple-myeloma/evidence-claims/bcma-antigen-escape-claim-set-v0.md",
      "metadata_path": "disease-programs/multiple-myeloma/evidence-claims/bcma-antigen-escape-claim-set-v0.metadata.json",
      "source_count": 4,
      "limitation_count": 8
    },
    {
      "artifact_id": "bcma-antigen-escape-evidence-gap-register-v0",
      "title": "BCMA Antigen Escape Evidence Gap Register v0",
      "artifact_class": "dataset",
      "claim_level": "open-question",
      "blood_cancer_scope": [
        "multiple myeloma",
        "BCMA-directed therapy",
        "post-BCMA relapse",
        "post-CAR T relapse"
      ],
      "path": "disease-programs/multiple-myeloma/evidence-gaps/bcma-antigen-escape-evidence-gap-register-v0.md",
      "metadata_path": "disease-programs/multiple-myeloma/evidence-gaps/bcma-antigen-escape-evidence-gap-register-v0.metadata.json",
      "source_count": 6,
      "limitation_count": 8
    },
    {
      "artifact_id": "bcma-antigen-escape-public-task-queue-v0",
      "title": "BCMA Antigen Escape Public Task Queue v0",
      "artifact_class": "dataset",
      "claim_level": "open-question",
      "blood_cancer_scope": [
        "multiple myeloma",
        "BCMA-directed therapy",
        "post-BCMA relapse",
        "post-CAR T relapse"
      ],
      "path": "disease-programs/multiple-myeloma/public-tasks/bcma-antigen-escape-public-task-queue-v0.md",
      "metadata_path": "disease-programs/multiple-myeloma/public-tasks/bcma-antigen-escape-public-task-queue-v0.metadata.json",
      "source_count": 2,
      "limitation_count": 7
    },
    {
      "artifact_id": "bcma-measurement-context-audit-v0",
      "title": "BCMA Measurement Context Audit v0",
      "artifact_class": "dataset",
      "claim_level": "open-question",
      "blood_cancer_scope": [
        "multiple myeloma",
        "BCMA-directed therapy",
        "post-BCMA relapse",
        "post-CAR T relapse",
        "measurement context"
      ],
      "path": "disease-programs/multiple-myeloma/measurements/bcma-measurement-context-audit-v0.md",
      "metadata_path": "disease-programs/multiple-myeloma/measurements/bcma-measurement-context-audit-v0.metadata.json",
      "source_count": 2,
      "limitation_count": 6
    },
    {
      "artifact_id": "multiple-myeloma-case-specific-private-lab-blocker-register-v0",
      "title": "Case-Specific Private-Lab Blocker Register v0",
      "artifact_class": "dataset",
      "claim_level": "open-question",
      "blood_cancer_scope": [
        "multiple myeloma",
        "plasma-cell disease",
        "case-to-cure pipeline",
        "private-lab blockers",
        "public safety"
      ],
      "path": "disease-programs/multiple-myeloma/case-specific-private-lab-blocker-register-v0.md",
      "metadata_path": "disease-programs/multiple-myeloma/case-specific-private-lab-blocker-register-v0.metadata.json",
      "source_count": 10,
      "limitation_count": 12
    },
    {
      "artifact_id": "machine-representation-source-extraction-v0",
      "title": "Machine Representation Source Extraction v0",
      "artifact_class": "dataset",
      "claim_level": "open-question",
      "blood_cancer_scope": [
        "multiple myeloma",
        "plasma-cell disease",
        "machine representation",
        "source extraction",
        "myeloma state object",
        "public source IDs",
        "source-context gaps",
        "expert review",
        "public safety"
      ],
      "path": "disease-programs/multiple-myeloma/machine-representation-source-extraction-v0.md",
      "metadata_path": "disease-programs/multiple-myeloma/machine-representation-source-extraction-v0.metadata.json",
      "source_count": 19,
      "limitation_count": 23
    },
    {
      "artifact_id": "machine-representation-source-gap-task-queue-v0",
      "title": "Machine Representation Source-Gap Task Queue v0",
      "artifact_class": "dataset",
      "claim_level": "open-question",
      "blood_cancer_scope": [
        "multiple myeloma",
        "plasma-cell disease",
        "machine representation",
        "source extraction",
        "source-context gaps",
        "public task queue",
        "expert review",
        "public contribution",
        "public safety"
      ],
      "path": "disease-programs/multiple-myeloma/public-tasks/machine-representation-source-gap-task-queue-v0.md",
      "metadata_path": "disease-programs/multiple-myeloma/public-tasks/machine-representation-source-gap-task-queue-v0.metadata.json",
      "source_count": 10,
      "limitation_count": 24
    },
    {
      "artifact_id": "mrd-and-relapse-measurement-glossary-v0",
      "title": "MRD And Relapse Measurement Glossary v0",
      "artifact_class": "dataset",
      "claim_level": "derived",
      "blood_cancer_scope": [
        "multiple myeloma",
        "measurable residual disease",
        "response assessment",
        "relapse assessment"
      ],
      "path": "disease-programs/multiple-myeloma/measurements/mrd-and-relapse-measurement-glossary-v0.md",
      "metadata_path": "disease-programs/multiple-myeloma/measurements/mrd-and-relapse-measurement-glossary-v0.metadata.json",
      "source_count": 6,
      "limitation_count": 7
    },
    {
      "artifact_id": "multiple-myeloma-expert-response-validation-ledger-v0",
      "title": "Multiple Myeloma Expert Response Validation Ledger v0",
      "artifact_class": "dataset",
      "claim_level": "open-question",
      "blood_cancer_scope": [
        "multiple myeloma",
        "plasma-cell disease",
        "expert validation",
        "response intake",
        "public safety"
      ],
      "path": "disease-programs/multiple-myeloma/reviews/expert-response-validation-ledger-v0.md",
      "metadata_path": "disease-programs/multiple-myeloma/reviews/expert-response-validation-ledger-v0.metadata.json",
      "source_count": 9,
      "limitation_count": 12
    },
    {
      "artifact_id": "multiple-myeloma-expert-validation-issue-index-v0",
      "title": "Multiple Myeloma Expert Validation Issue Index v0",
      "artifact_class": "dataset",
      "claim_level": "open-question",
      "blood_cancer_scope": [
        "multiple myeloma",
        "plasma-cell disease",
        "expert validation",
        "public issues",
        "public safety"
      ],
      "path": "disease-programs/multiple-myeloma/reviews/expert-validation-issue-index-v0.md",
      "metadata_path": "disease-programs/multiple-myeloma/reviews/expert-validation-issue-index-v0.metadata.json",
      "source_count": 16,
      "limitation_count": 11
    },
    {
      "artifact_id": "multiple-myeloma-expert-validation-outreach-map-v0",
      "title": "Multiple Myeloma Expert Validation Outreach Map v0",
      "artifact_class": "dataset",
      "claim_level": "open-question",
      "blood_cancer_scope": [
        "multiple myeloma",
        "plasma-cell disease",
        "expert validation",
        "expert outreach",
        "public safety"
      ],
      "path": "disease-programs/multiple-myeloma/reviews/expert-validation-outreach-map-v0.md",
      "metadata_path": "disease-programs/multiple-myeloma/reviews/expert-validation-outreach-map-v0.metadata.json",
      "source_count": 21,
      "limitation_count": 11
    },
    {
      "artifact_id": "multiple-myeloma-public-inventory-v0",
      "title": "Multiple Myeloma Public Inventory v0",
      "artifact_class": "dataset",
      "claim_level": "open-question",
      "blood_cancer_scope": [
        "multiple myeloma",
        "plasma-cell disease",
        "public inventory",
        "public navigation",
        "public safety"
      ],
      "path": "disease-programs/multiple-myeloma/public-inventory-v0.md",
      "metadata_path": "disease-programs/multiple-myeloma/public-inventory-v0.metadata.json",
      "source_count": 48,
      "limitation_count": 11
    },
    {
      "artifact_id": "multiple-myeloma-roadmap-public-task-queue-v0",
      "title": "Multiple Myeloma Roadmap Public Task Queue v0",
      "artifact_class": "dataset",
      "claim_level": "open-question",
      "blood_cancer_scope": [
        "multiple myeloma",
        "plasma-cell disease",
        "public roadmap",
        "case-to-cure pipeline",
        "research tooling"
      ],
      "path": "disease-programs/multiple-myeloma/public-tasks/multiple-myeloma-roadmap-public-task-queue-v0.md",
      "metadata_path": "disease-programs/multiple-myeloma/public-tasks/multiple-myeloma-roadmap-public-task-queue-v0.metadata.json",
      "source_count": 4,
      "limitation_count": 9
    },
    {
      "artifact_id": "multiple-myeloma-synthetic-caregiver-intake-v0",
      "title": "Multiple Myeloma Synthetic Caregiver Intake v0",
      "artifact_class": "dataset",
      "claim_level": "open-question",
      "blood_cancer_scope": [
        "multiple myeloma",
        "plasma-cell disease",
        "caregiver intake",